{"schema":"openshard.gate_verdict.v1","sha":"aaaaaaaaaaaaaaaaaaaaaaaaaaaaaaaaaaaaaaaa","repository":"acme/widget","status":"verified","policy":{"require_receipt":"agent_prs"},"receipts":[{"receipt_id":"rcpt_29c27d6dc7309152fe77c9ff6e0a979d","url":"https://app.openshard.dev/receipts/rcpt_29c27d6dc7309152fe77c9ff6e0a979d","status":"verified","agent":"Codex","model":null,"task":"Gate fixture","files_changed":1,"lines_added":3,"lines_removed":1,"checks":[{"name":"tests","outcome":"passed","source":"independently_verified"}],"verification":{"result":"passed","verified_at":"2026-10-20T12:00:05Z","bound_commit":"aaaaaaaaaaaaaaaaaaaaaaaaaaaaaaaaaaaaaaaa"},"cost":{"usd":null,"source":null},"approvals":null,"witnessed":false,"signature_verified":null,"merge_check":null}],"merge_group":{"requested_sha":"4444444444444444444444444444444444444444","pull_request":7,"head_sha":"aaaaaaaaaaaaaaaaaaaaaaaaaaaaaaaaaaaaaaaa"},"reason":null,"checked_at":"2026-10-21T01:46:03.772Z"}
